{"$schema":"http://json-schema.org/draft-07/schema#","title":"RuleSetSnapshot v1","type":"object","additionalProperties":false,"required":["schemaVersion","snapshotId","version","contentHash","approvedChangeRuleVersionId","rules","createdAt"],"properties":{"schemaVersion":{"const":1},"snapshotId":{"type":"string"},"version":{"type":"integer","minimum":1},"contentHash":{"type":"string"},"approvedChangeRuleVersionId":{"type":"string"},"rules":{"type":"array","minItems":1,"items":{"type":"object","additionalProperties":false,"required":["ruleId","ruleVersion","evaluationOrder","severity","definition"],"properties":{"ruleId":{"type":"string"},"ruleVersion":{"type":"integer","minimum":1},"evaluationOrder":{"type":"integer","minimum":0},"severity":{"enum":["LOW","MEDIUM","HIGH","CRITICAL"]},"definition":{"type":"object"}}}},"createdAt":{"type":"string"}}}
