{"schemaVersion":1,"snapshotId":"set-01","version":1,"contentHash":"sha256:abc","approvedChangeRuleVersionId":"rv-01","rules":[{"ruleId":"rule-01","ruleVersion":1,"evaluationOrder":0,"severity":"HIGH","definition":{"type":"AMOUNT_THRESHOLD","amountMinor":10000,"currency":"BRL"}}],"createdAt":"2026-09-05T12:00:00Z"}
